PoleStudio_Name,Adresse,PLZ,Stadt,Straße,Buttons,Pole Studio Beschreibung,E-Mail,Homepage,Telefon,URL_S,Art,Angebot,Created Date,Updated Date
Tanzstudio Michel,"['Schmalweg 50 ', ' 55252 Wiesbaden']",55252,Wiesbaden,Schmalweg 50,"['Übersicht', 'Klassen', 'Preise', 'Team']","Das etablierte Tanzstudio in Wiesbaden bietet professionelles Tanztrainig und Kurse zum fit werden. Ein heller, geräumiger, eigens für den Tanzunterricht gestalteter Trainingssaal ist bereit dir alle Möglichkeiten zu bieten noch besser zu werden. Tanz und Schönheit der Bewegung – hier sind diese zwei Begriffe untrennbar.", t.michel.9@gmx.de,https://www.tanzstudio-michel.de/,+49 15115125871,https://www.eversports.de/s/tanzstudio-michel,"['1 Rezensionen', 'Fitness', 'Tanzen', 'Poledance', 'Stretching', 'Dehnung/Flexibilität', 'Exotic']",Zum Stundenplan,2024-02-17 13:59:44,2024-02-17 13:59:44
Polestation Academy,"['Marktstraße 20b ', ' 6971 Hard']",6971,Hard,Marktstraße 20b,"['Übersicht', 'Klassen', 'Videos', 'Preise', 'Team']","Polestation Academy ist ein Ort für Pole und Aerial Arts. Das vielseitige Angebot umfaßt aber weitaus mehr. Unsere Stunden sind nicht nur für Polebegeisterte interessant. Unter anderem bieten wir auch Flexibilitytrainings und Workouts (HIIT, Bodyshape...) an. Wir befinden uns in Hard mitten im Zentrum und nur wenige Gehminuten zum See.Weitere Angebote sind: Kids und Teenie Polefitness Kurse, Schnupperlektionen nach Absprache, Privatstunden und Polterevents.In unserem Studio herrscht eine schöne und unkomplizierte Atmosphäre. Alle Frauen egal in welchem Alter sind bei uns herzlich willkommen!", blum.n@gmx.at,http://www.polestation.com,+43 6642006568,https://www.eversports.de/s/polestation-academy,"['Poledance', 'Poledance', 'Poledance', 'Poledance', 'Poledance', '13 Rezensionen', 'Poledance']",Zum Stundenplan,2024-02-17 13:59:52,2024-02-17 13:59:52
Poledance 4 you,"['Naugarder Straße 14', ' 10409 Berlin']",10409,Berlin,Naugarder Straße 14,['Übersicht'],"Das Motto des Berliner Pole Dance Studios lautet ""Anders tanzen als der Rest der Welt."" Pole Dance ist eine körperbewusste und abwechslungsreiche Art des Tanzes. und der neueste Trend, der Frauenherzen höher schlagen lässt. Es ist Ästhetik pur, du verbessert gleichzeitig deine sportliche Fitness und gehst nach jedem Training mit einem positiven Lebensgefühl nach Hause.
Auch Hollywood-Stars wie Britney Spears, Angelina Jolie und Madonna haben Pole Dance für sich entdeckt. 
Es gibt unterschiedliche Levels mit unterschiedlichen Schwerpunkten, die professionell geschult werden.", info@poledance4you.de,https://www.poledance4you.de/,,https://www.eversports.de/s/poledance-4-you,"['(Noch keine Bewertungen)', 'Poledance']",,2024-02-17 13:59:58,2024-02-17 13:59:58
Luftbonbon,"['Königstraße 45 ', ' 32547 Bad Oeynhausen']",32547,Bad,Königstraße 45,"['Übersicht', 'Klassen', 'Workshops', 'Preise', 'Team']","Entdecke mit uns die vielseitige Welt der Luftakrobatik.Dazu gehört Poledance (Stangenakrobatik), Aerial Hoop (Luftring), Aerial Hammock (Tuch, U-förmig).Zum Ausgleich bieten wir Mobility Kurse an, für den Aufbau von Kraft, Flexibilität, Balance.Workshops, Privatstunden, JGA, Aerial Partys und freie Trainings finden regelmäßig statt, auch auf Anfrage.", info@luftbonbon.com,https://www.luftbonbon.com/,01622572081,https://www.eversports.de/s/luftbonbon,"['Poledance', 'Aerial Hoop', 'Poledance', 'Stärkung/Flexibilität', 'Poledance', '16 Rezensionen', 'Poledance', 'Aerial Yoga', 'Chairdance', 'Aerial Hoop', 'Mobility', 'Stärkung/Flexibilität', 'Aerial Hammock']",Zum Stundenplan,2024-02-17 14:00:03,2024-02-17 14:00:03
